{
  "$schema": "https://json-schema.org/draft/2020-12/schema",
  "$id": "https://github.com/dogfood-lab/testing-os/packages/schemas/src/json/agent-output.schema.json",
  "title": "Swarm Agent Output (canonical envelope)",
  "description": "JSON contract for agent JSON outputs written to swarms/<run-id>/wave-N/<domain>.json. F-252713-017 (Phase 7 wave 1): collect-time schema-conformance gate. Replaces silent normalization in collect.js with a structured error pointing the agent at the canonical shape. Validates the OUTER envelope — every agent output regardless of phase has { domain, summary } at minimum. Phase-specific oneOf branches govern the inner shape: audit outputs carry findings[], feature outputs carry features[], amend outputs carry fixes[] + files_changed[]. Mirrors AUDIT_CATEGORIES + FEATURE_CATEGORIES + SEVERITY_ENUM in packages/dogfood-swarm/lib/output-schema.js — kept in lockstep.",
  "type": "object",
  "required": ["domain", "summary"],
  "additionalProperties": true,
  "properties": {
    "domain": {
      "type": "string",
      "minLength": 1,
      "description": "Audit domain that produced this output (e.g. backend, ci-tooling, docs, outputs, pipeline)."
    },
    "stage": {
      "type": "string",
      "enum": ["A", "B", "C", "D"],
      "description": "Health-pass stage (audit outputs only). Optional in feature/amend outputs."
    },
    "summary": {
      "type": "string",
      "minLength": 1,
      "description": "One-line summary of what the agent did and what they found."
    },
    "findings": {
      "type": "array",
      "items": { "$ref": "#/$defs/finding" },
      "description": "Audit-pass findings. Required in audit outputs (Stages A–D)."
    },
    "features": {
      "type": "array",
      "items": { "$ref": "#/$defs/feature" },
      "description": "Feature-pass features. Required in feature-pass outputs."
    },
    "fixes": {
      "type": "array",
      "items": { "$ref": "#/$defs/fix" },
      "description": "Amend-pass fixes. Required in amend outputs (Phase 7 waves)."
    },
    "files_changed": {
      "type": "array",
      "items": { "type": "string" },
      "description": "Files the agent edited. Required in amend outputs."
    },
    "skipped": {
      "type": "array",
      "items": { "$ref": "#/$defs/skip" },
      "description": "Findings/features skipped with a reason. Cross-domain dependencies, blocked-on items, etc."
    },
    "verification_skipped": {
      "type": "boolean",
      "default": false,
      "description": "Set true when the agent skipped per-agent verification per the parallel-wave serial-final-verify discipline (PROTOCOL.md §Serial final verification). Coordinator runs a single `npm run verify` against the cumulative tree at collect time. False or absent = agent ran its own verify (legacy single-agent waves, manual dispatch)."
    }
  },
  "$defs": {
    "finding": {
      "type": "object",
      "required": ["id", "severity", "category", "description"],
      "additionalProperties": true,
      "properties": {
        "id": { "type": "string", "minLength": 1 },
        "severity": {
          "type": "string",
          "enum": ["CRITICAL", "HIGH", "MEDIUM", "LOW"],
          "description": "Mirrors SEVERITY_ENUM in packages/dogfood-swarm/lib/output-schema.js."
        },
        "category": {
          "type": "string",
          "enum": [
            "bug", "security", "quality", "types", "tests", "docs",
            "defensive", "observability", "degradation", "future-proofing",
            "ux", "accessibility",
            "hygiene", "error_message_quality", "cli_help_quality",
            "silent_failure", "tests_coverage"
          ],
          "description": "Mirrors AUDIT_CATEGORIES in packages/dogfood-swarm/lib/output-schema.js. Extended in Phase 7 wave 2 W2-BACK-002 to absorb 5 historical wave-15/20 reused categories (hygiene, error_message_quality, cli_help_quality, silent_failure, tests_coverage). Underscore form preserved as historical record."
        },
        "file": { "type": "string" },
        "line": { "type": "number" },
        "symbol": { "type": "string" },
        "description": { "type": "string", "minLength": 1 },
        "recommendation": { "type": "string" },
        "rule_id": { "type": "string" }
      }
    },
    "feature": {
      "type": "object",
      "required": ["id", "priority", "category", "description"],
      "additionalProperties": true,
      "properties": {
        "id": { "type": "string", "pattern": "^F-[A-Za-z0-9-]+$" },
        "priority": {
          "type": "string",
          "enum": ["CRITICAL", "HIGH", "MEDIUM", "LOW"]
        },
        "category": {
          "type": "string",
          "enum": ["missing-feature", "ux", "performance", "integration", "production-readiness"]
        },
        "description": { "type": "string", "minLength": 1 },
        "use_case": { "type": "string" },
        "evidence_base": { "type": "string" },
        "scope": { "type": "array", "items": { "type": "string" } },
        "effort": { "type": "string", "enum": ["small", "medium", "large"] },
        "cross_ref": { "type": "string" },
        "recommendation": { "type": "string" }
      }
    },
    "fix": {
      "type": "object",
      "required": ["finding_id", "description"],
      "additionalProperties": true,
      "properties": {
        "finding_id": { "type": "string", "minLength": 1 },
        "file": { "type": "string" },
        "description": { "type": "string", "minLength": 1 }
      }
    },
    "skip": {
      "type": "object",
      "required": ["finding_id", "reason"],
      "additionalProperties": true,
      "properties": {
        "finding_id": { "type": "string", "minLength": 1 },
        "reason": { "type": "string", "minLength": 1 }
      }
    }
  }
}
